{
  "$schema": "schemas/tool-catalog.schema.json",
  "formatVersion": "roslyn-workbench-tool-reference/v1",
  "productVersion": "0.1.0",
  "sourceTag": "0.1.0",
  "commit": "a4df43bdf65904c6b495054d88ac5a270142657a",
  "tools": [
    {
      "name": "analyze-async",
      "title": "Analyze Async",
      "area": "CorePlugin",
      "category": "Code analysis",
      "operationKind": "Query",
      "summary": "Returns bundled AsyncFixer diagnostics and compiler diagnostic CS4014 for a selected scope.",
      "availability": "Built in and published by default.",
      "detailUrl": "data/analyze-async.json",
      "documentationUrl": "https://lantean-code.github.io/roslyn-workbench-mcp/0.1.0/reference/tools/analyze-async.html"
    },
    {
      "name": "analyze-control-flow",
      "title": "Analyze Control Flow",
      "area": "CorePlugin",
      "category": "Code analysis",
      "operationKind": "Query",
      "summary": "Analyzes control flow for an exact complete statement or contiguous statement range.",
      "availability": "Built in and published by default.",
      "detailUrl": "data/analyze-control-flow.json",
      "documentationUrl": "https://lantean-code.github.io/roslyn-workbench-mcp/0.1.0/reference/tools/analyze-control-flow.html"
    },
    {
      "name": "analyze-data-flow",
      "title": "Analyze Data Flow",
      "area": "CorePlugin",
      "category": "Code analysis",
      "operationKind": "Query",
      "summary": "Analyzes data flow for an exact expression, complete statement, or contiguous statement range.",
      "availability": "Built in and published by default.",
      "detailUrl": "data/analyze-data-flow.json",
      "documentationUrl": "https://lantean-code.github.io/roslyn-workbench-mcp/0.1.0/reference/tools/analyze-data-flow.html"
    },
    {
      "name": "analyze-disposables",
      "title": "Analyze Disposables",
      "area": "CorePlugin",
      "category": "Code analysis",
      "operationKind": "Query",
      "summary": "Returns advisory findings for undisposed local disposable values.",
      "availability": "Built in and published by default.",
      "detailUrl": "data/analyze-disposables.json",
      "documentationUrl": "https://lantean-code.github.io/roslyn-workbench-mcp/0.1.0/reference/tools/analyze-disposables.html"
    },
    {
      "name": "analyze-nullability",
      "title": "Analyze Nullability",
      "area": "CorePlugin",
      "category": "Code analysis",
      "operationKind": "Query",
      "summary": "Returns nullable-flow diagnostics for a selected scope or location.",
      "availability": "Built in and published by default.",
      "detailUrl": "data/analyze-nullability.json",
      "documentationUrl": "https://lantean-code.github.io/roslyn-workbench-mcp/0.1.0/reference/tools/analyze-nullability.html"
    },
    {
      "name": "find-callees",
      "title": "Find Callees",
      "area": "CorePlugin",
      "category": "Code discovery and navigation",
      "operationKind": "Query",
      "summary": "Returns symbols directly invoked by a method or selected executable body.",
      "availability": "Built in and published by default.",
      "detailUrl": "data/find-callees.json",
      "documentationUrl": "https://lantean-code.github.io/roslyn-workbench-mcp/0.1.0/reference/tools/find-callees.html"
    },
    {
      "name": "find-callers",
      "title": "Find Callers",
      "area": "CorePlugin",
      "category": "Code discovery and navigation",
      "operationKind": "Query",
      "summary": "Returns bounded direct source call sites and containing symbols.",
      "availability": "Built in and published by default.",
      "detailUrl": "data/find-callers.json",
      "documentationUrl": "https://lantean-code.github.io/roslyn-workbench-mcp/0.1.0/reference/tools/find-callers.html"
    },
    {
      "name": "find-dependency-cycles",
      "title": "Find Dependency Cycles",
      "area": "CorePlugin",
      "category": "Code analysis",
      "operationKind": "Query",
      "summary": "Returns detected dependency cycles for the selected scope and granularity.",
      "availability": "Built in and published by default.",
      "detailUrl": "data/find-dependency-cycles.json",
      "documentationUrl": "https://lantean-code.github.io/roslyn-workbench-mcp/0.1.0/reference/tools/find-dependency-cycles.html"
    },
    {
      "name": "find-derived-types",
      "title": "Find Derived Types",
      "area": "CorePlugin",
      "category": "Code discovery and navigation",
      "operationKind": "Query",
      "summary": "Finds derived types for a resolved base type.",
      "availability": "Built in and published by default.",
      "detailUrl": "data/find-derived-types.json",
      "documentationUrl": "https://lantean-code.github.io/roslyn-workbench-mcp/0.1.0/reference/tools/find-derived-types.html"
    },
    {
      "name": "find-duplicate-code",
      "title": "Find Duplicate Code",
      "area": "CorePlugin",
      "category": "Code analysis",
      "operationKind": "Query",
      "summary": "Returns bounded duplicate executable-block pointers that normalize to the same statement sequence.",
      "availability": "Built in and published by default.",
      "detailUrl": "data/find-duplicate-code.json",
      "documentationUrl": "https://lantean-code.github.io/roslyn-workbench-mcp/0.1.0/reference/tools/find-duplicate-code.html"
    },
    {
      "name": "find-implementations",
      "title": "Find Implementations",
      "area": "CorePlugin",
      "category": "Code discovery and navigation",
      "operationKind": "Query",
      "summary": "Finds implementations of an interface or abstract member.",
      "availability": "Built in and published by default.",
      "detailUrl": "data/find-implementations.json",
      "documentationUrl": "https://lantean-code.github.io/roslyn-workbench-mcp/0.1.0/reference/tools/find-implementations.html"
    },
    {
      "name": "find-overloads",
      "title": "Find Overloads",
      "area": "CorePlugin",
      "category": "Code discovery and navigation",
      "operationKind": "Query",
      "summary": "Returns overload signatures for a resolved method or constructor.",
      "availability": "Built in and published by default.",
      "detailUrl": "data/find-overloads.json",
      "documentationUrl": "https://lantean-code.github.io/roslyn-workbench-mcp/0.1.0/reference/tools/find-overloads.html"
    },
    {
      "name": "find-overrides",
      "title": "Find Overrides",
      "area": "CorePlugin",
      "category": "Code discovery and navigation",
      "operationKind": "Query",
      "summary": "Finds overrides of a virtual or abstract member.",
      "availability": "Built in and published by default.",
      "detailUrl": "data/find-overrides.json",
      "documentationUrl": "https://lantean-code.github.io/roslyn-workbench-mcp/0.1.0/reference/tools/find-overrides.html"
    },
    {
      "name": "find-references",
      "title": "Find References",
      "area": "CorePlugin",
      "category": "Code discovery and navigation",
      "operationKind": "Query",
      "summary": "Finds source references, optionally including declarations and access classification.",
      "availability": "Built in and published by default.",
      "detailUrl": "data/find-references.json",
      "documentationUrl": "https://lantean-code.github.io/roslyn-workbench-mcp/0.1.0/reference/tools/find-references.html"
    },
    {
      "name": "find-unused-symbols",
      "title": "Find Unused Symbols",
      "area": "CorePlugin",
      "category": "Code analysis",
      "operationKind": "Query",
      "summary": "Returns candidate unused locals and members from compiler diagnostics.",
      "availability": "Built in and published by default.",
      "detailUrl": "data/find-unused-symbols.json",
      "documentationUrl": "https://lantean-code.github.io/roslyn-workbench-mcp/0.1.0/reference/tools/find-unused-symbols.html"
    },
    {
      "name": "format-document",
      "title": "Format Document",
      "area": "CorePlugin",
      "category": "Code mutation",
      "operationKind": "Mutation",
      "summary": "Stages Roslyn formatting for one document or one selected range.",
      "availability": "Built in and published by default.",
      "detailUrl": "data/format-document.json",
      "documentationUrl": "https://lantean-code.github.io/roslyn-workbench-mcp/0.1.0/reference/tools/format-document.html"
    },
    {
      "name": "get-api-surface",
      "title": "Get API Surface",
      "area": "CorePlugin",
      "category": "Code discovery and navigation",
      "operationKind": "Query",
      "summary": "Returns exported API symbols for a selected scope.",
      "availability": "Built in and published by default.",
      "detailUrl": "data/get-api-surface.json",
      "documentationUrl": "https://lantean-code.github.io/roslyn-workbench-mcp/0.1.0/reference/tools/get-api-surface.html"
    },
    {
      "name": "get-change-impact",
      "title": "Get Change Impact",
      "area": "CorePlugin",
      "category": "Code analysis",
      "operationKind": "Query",
      "summary": "Returns a bounded impact summary and supporting source locations for a symbol change.",
      "availability": "Built in and published by default.",
      "detailUrl": "data/get-change-impact.json",
      "documentationUrl": "https://lantean-code.github.io/roslyn-workbench-mcp/0.1.0/reference/tools/get-change-impact.html"
    },
    {
      "name": "get-code-context",
      "title": "Get Code Context",
      "area": "CorePlugin",
      "category": "Code discovery and navigation",
      "operationKind": "Query",
      "summary": "Returns a bounded code window with the enclosing semantic context for a selected location.",
      "availability": "Built in and published by default.",
      "detailUrl": "data/get-code-context.json",
      "documentationUrl": "https://lantean-code.github.io/roslyn-workbench-mcp/0.1.0/reference/tools/get-code-context.html"
    },
    {